file_name,uni,wylie,url,dept,grade,char_len,audio_len,path,inf
STT_TT00689_0747_4639906_to_4649735,དམིགས་རྣམ་དྲན་ཐུབ་ཀི་མ་རེད་ལབ་པ་རེད། དེ་ད་དངོས་གནས་ཡིན་ས་རེད། ན་ཚ་ཧ་ཅང་ཤུགས་ཆེན་པོ་སླེབས་དུས། དྲན་ཐུབ་ཀི་མི་འདུག་གཱ། སེམས་ཚང་མ་ཁོ་ན་ཚ་གིས་ཐེན་ནས། ཨོ་དེ་དྲན་དཀའ།  ,dmigs rnam dran thub ki ma red lab pa red/_de da dngos gnas yin sa red/_na tsha ha cang shugs chen po slebs dus/_dran thub ki mi 'dug gA/_sems tshang ma kho na tsha gis then nas/_o de dran dka'/__,https://d38pmlk0v88drf.cloudfront.net/wav16k/STT_TT00689_0747_4639906_to_4649735.wav,STT_TT,3,162,9.829,wav16k/STT_TT00689_0747_4639906_to_4649735.wav,དམིགས་རྣམ་དྲན་ཐུབ་ཀི་མ་རེད་ལབ་པ་རེད། དེ་ད་དངོས་གནས་ཡིན་ས་རེད། ན་ཚ་ཧ་ཅང་ཤུགས་ཆེན་པོ་སླེབས་དུས། དྲན་ཐུབ་ཀི་མི་འདུག་ག། སེམས་ཚང་མ་ ཕོ་ན་ཚ་གིས་འཐེན་ནས། ཨོ་དེ་དྲན་དཀའ།
STT_TT00677_0579_4538199_to_4547039,སེམས་ཅན་ལ་གནོད་པ་ཚ་པོ་བྱེད་མཁན་ཅིག་ལ་འགོང་པོ་ཟེ་གི་ཡོད་རེད་བ། ཨོ་དེ་འདྲའི་གི་ཁྱབ་པ་ད་ཡོད་མ་རེད་དེ། སྤྱིར་བཏང་དེ་འདྲ་ཟེ་གི་ཡོད་རེད་བ། དེ་ཡིན་ཙང་། རང་གཅེས་འཛིན་དེ་ལ་ ,sems can la gnod pa tsha po byed mkhan cig la 'gong po ze gi yod red ba/_o de 'dra'i gi khyab pa da yod ma red de/_spyir btang de 'dra ze gi yod red ba/_de yin tsang /_rang gces 'dzin de la _,https://d38pmlk0v88drf.cloudfront.net/wav16k/STT_TT00677_0579_4538199_to_4547039.wav,STT_TT,3,164,8.84,wav16k/STT_TT00677_0579_4538199_to_4547039.wav,སེམས་ཅན་ལ་གནོད་པ་ཚ་བོ་བྱེད་མཁན་ཅིག་ལ། དགོང་པོ་ཟེར་གི་ཡོད་རེད་བ། ཨོ་དེ་འདྲའ་གི།་ཁྱབ་པ་ད་ཡོད་མ་རེད་དེ། སྤྱིར་བཏང་དེ་འདྲའི་ཟེར་གི་ཡོད་རེད་བ། དེ་ཡིན་ཙང་། རང་གཅེས་འཛིན་དེ་ལ།
STT_TT00659_0628_5832161_to_5834977,ད་ངས་པར་ཆས་དེ་གི་པར་ཆས་སྒྲིག་སྟངས་དེ་ནོར་བ་ཅིག་བསྒྲིགས་ན།  ,da ngas par chas de gi par chas sgrig stangs de nor ba cig bsgrigs na/__,https://d38pmlk0v88drf.cloudfront.net/wav16k/STT_TT00659_0628_5832161_to_5834977.wav,STT_TT,3,59,2.816,wav16k/STT_TT00659_0628_5832161_to_5834977.wav,ད་ངས་པར་རྗས་དེ་གིས། པར་ཆས་སྒྲིག་སྟངས་དེ། ནོར་བ་ཅིག་བསྒྲིགས་ན།
STT_TT00689_0823_5199706_to_5202330,འགལ་རྐྱེན་སེལ་ཞིང་མཐུན་རྐྱེན་སྒྲུབ་པའི་དགོས་པ་ཡོད་པ་ལྟར་ཟེ།  ,'gal rkyen sel zhing mthun rkyen sgrub pa'i dgos pa yod pa ltar ze/__,https://d38pmlk0v88drf.cloudfront.net/wav16k/STT_TT00689_0823_5199706_to_5202330.wav,STT_TT,3,61,2.624,wav16k/STT_TT00689_0823_5199706_to_5202330.wav,འགལ་རྐྱེན་སེལ་ཞིང་མཐུན་རྐྱེན་སྒྲུབ་པའི་དགོས་པ་ཡོད་པ་ལྟར་ཟེ།
STT_TT00676_0565_3791936_to_3800981,དེ་ནས་གཞན་གྱི་བདེ་སྡུག་ཚང་མ་བདག་གིས་ཡིན་པ་འདྲ་བོ་ཅིག་སྣང་བ་ཤར་ནས། ཨེ་ནས་གཞན་གྱི་བདེ་སྡུག། སྡུག་བསྔལ་སེལ་ཡ་དང་བདེ་སྐྱིད་བསྒྲུབ་ཡ་ལ་རྦད་དེ་གོམས། ཤུགས་སྐྱོན་ཡ་ཅིག་ཡོང་གི་རེད་ཟེ།  ,de nas gzhan gyi bde sdug tshang ma bdag gis yin pa 'dra bo cig snang ba shar nas/_e nas gzhan gyi bde sdug/_sdug bsngal sel ya dang bde skyid bsgrub ya la rbad de goms/_shugs skyon ya cig yong gi red ze/__,https://d38pmlk0v88drf.cloudfront.net/wav16k/STT_TT00676_0565_3791936_to_3800981.wav,STT_TT,3,176,9.045,wav16k/STT_TT00676_0565_3791936_to_3800981.wav,དེ་ནས་གཞན་གི་བདེ་སྡུག་ཚང་མ། བདག་གིས་ཡིན་པ་འདྲ་བོ་ཅིག སྣང་བ་ཤར་ནས། ཨེ་ནས་ གཞན་གི་བདེ་སྡུག སྡུག་བསྔལ་སེལ་ཡ་དང་བདེ་སྐྱིད་སྒྲུབ་ཡ་ལ་རྦད་དེ་ཁོམས། ཤུགས་སྐྱོན་ཡ་ཅིག་ཡོང་གི་རེད་ཟེ།
STT_NS_M0239_0237_2535742_to_2544974,ཨོ་དེ་ད་ལྟ་སྤྲོ་སྐྱིད་ལྡན་པའི་འཚོ་བ་ལབ་ཡ་ཅིག་འདུག་བ། ཨོ་དེ་ད་ལྟ་ལྷ་ས་ནས་རེད་རཱ། ཨེ་ནས་ལྷ་ས་ནས་ལྟད་མོ་དེ་འཁྲབ་དུས་ཡོད་དུས་སྐབས་སུ་ལ་ད་ལྟ་ཁྱེད་རང་ཚོ་གི་ཧ་གོ་ཡི་ཡོད་ཀྱི་རེད་གལ་སྲིད་ད་ ,o de da lta spro skyid ldan pa'i 'tsho ba lab ya cig 'dug ba/_o de da lta lha sa nas red rA/_e nas lha sa nas ltad mo de 'khrab dus yod dus skabs su la da lta khyed rang tsho gi ha go yi yod kyi red gal srid da _,https://d38pmlk0v88drf.cloudfront.net/wav16k/STT_NS_M0239_0237_2535742_to_2544974.wav,STT_NS,3,181,9.232,wav16k/STT_NS_M0239_0237_2535742_to_2544974.wav,ཨོ་དེ་ད་ལྟ་སྤྲོ་སྐྱིད་ལྟན་པའི་ཚོར་བ་ལབ་ཡ་ཅིག་འདུག་བ། ཨོ་དེ་ད་ལྟ་ལྷ་ས་ནས་རེད་རཱ། ཨེ་ནས་ལྷ་ས་ནས་ལྟད་མོ་དེ་འཁྲབ་དུས་ཡོད་དུས་སྐབས་སུ་ལ་ད་ལྟ་ཁྱེད་རང་ཚོ་གིས་ཧ་གོ་ཡི་ཡོད་ཀྱི་རེད་གལ་སྲིད་ད།
STT_TT00678_0715_5234837_to_5242414,སྡུག་བསྔལ་གསུམ་དང་དྲུག་དང་བརྒྱད་ལ་སོགས་པའི་མནར་བ་དེ་སྙིང་རེ་རྗེ། སེམས་ཅན་དེ་དག་སྡུག་བསྔལ་དང་སྡུག་བསྔལ་གྱི་རྒྱུ་དང་བཅས་པ་ལས་བྲལ་བ་ཞིག་བདག་གིས་བྱའོ་སྙམ་དུ།  ,sdug bsngal gsum dang drug dang brgyad la sogs pa'i mnar ba de snying re rje/_sems can de dag sdug bsngal dang sdug bsngal gyi rgyu dang bcas pa las bral ba zhig bdag gis bya'o snyam du/__,https://d38pmlk0v88drf.cloudfront.net/wav16k/STT_TT00678_0715_5234837_to_5242414.wav,STT_TT,3,155,7.577,wav16k/STT_TT00678_0715_5234837_to_5242414.wav,སྡུག་བསྔལ་གསུམ་དང་དྲུག་དང་བརྒྱད་ལ་སོགས་པས་མནར་བ་དེ་སྙིང་རེ་རྗེ། སེམས་ཅན་དེ་དག་སྡུག་བསྔལ་དང་སྡུག་བསྔལ་གྱི་རྒྱུ་དང་བཅས་པ་ལས་བྲལ་བ་ཞིག་བདག་གིས་བྱའོ་སྙམ་དུ།
STT_TT00673_0164_1444753_to_1447505,འདི་ནི་ཀུན་འབྱུང་འཕགས་པའི་བདེན་པའོ། ཞེས་པ་འདི་གིས་བསྟན།  ,'di ni kun 'byung 'phags pa'i bden pa'o/_zhes pa 'di gis bstan/__,https://d38pmlk0v88drf.cloudfront.net/wav16k/STT_TT00673_0164_1444753_to_1447505.wav,STT_TT,3,57,2.752,wav16k/STT_TT00673_0164_1444753_to_1447505.wav,འདི་ནི་ཀུན་འབྱུང་འཕགས་པའི་བདེན་པའོ། ཞེས་པ་འདི་གིས་བསྟེན།
STT_TT00669_0005_38516_to_40532,ང་རང་ཚོ་འདི་ཡིན་ན་ད། ད་ལྟ་ཞོགས་ཀའི་རེད་བ།  ,nga rang tsho 'di yin na da/_da lta zhogs ka'i red ba/__,https://d38pmlk0v88drf.cloudfront.net/wav16k/STT_TT00669_0005_38516_to_40532.wav,STT_TT,3,43,2.016,wav16k/STT_TT00669_0005_38516_to_40532.wav,ང་རང་ཚོ་འདི་ཡིན་ན་ད་ད་ལྟ་ཞོགས་ཀའི་རེད་བ།
STT_NS_M0246_0149_892074_to_895571,ཨ་མ་ཁོ་ཚོའི་མི་ཚེ་དེ་སྐྱིད་མདོག་ཁ་ལ་སོ་སོ་རྐང་པའི་སྒང་ལ་ལངས་ཚར་རེད། ད་སོ་སོ་ ,a ma kho tsho'i mi tshe de skyid mdog kha la so so rkang pa'i sgang la langs tshar red/_da so so _,https://d38pmlk0v88drf.cloudfront.net/wav16k/STT_NS_M0246_0149_892074_to_895571.wav,STT_NS,3,77,3.497,wav16k/STT_NS_M0246_0149_892074_to_895571.wav,ཨ་མ་ཁོ་ཚོའི་མི་ཚེ་དི་སྐྱིད་མདོག་ཁ་ར་སོ་སོའི་རྐང་པ་སྒང་ལ་ལངས་ཚར་རེད། ད་སོ་སོ།
STT_NS_M0246_0105_650620_to_654393,ཁོ་ད་ང་ལ་གཡུག་ནས་འགྲོ་ས་མ་རེད་བསམ་ནས་སོ་སོའི་སེམས་པ་ནང་ལ་ཡིད་ཆེས་གཅིག་སླེབས་ཚར་བའི་གཞུག་གུ་ལ་ཨ་ནས།  ,kho da nga la g.yug nas 'gro sa ma red bsam nas so so'i sems pa nang la yid ches gcig slebs tshar ba'i gzhug gu la a nas/__,https://d38pmlk0v88drf.cloudfront.net/wav16k/STT_NS_M0246_0105_650620_to_654393.wav,STT_NS,3,100,3.773,wav16k/STT_NS_M0246_0105_650620_to_654393.wav,ཁོ་ད་ང་གཡུག་འགྲོ་ས་མ་རེད་བསམ་ནས་སོ་སོའི་སེམས་པ་ནང་ལ་ཡིད་ཆེས་གཅིག་སླེབས་ཚར་བའི་གཞུག་གུ་ལ་ཨེ་ནས།
STT_NS_M0243_0090_595810_to_604513,ཨེ་ནས་ལྷ་མོ་འདྲ་བོར་ཆ་བཞག་བ་ར་ཅིག་ཡིན་ན། མོ་རང་ད་ལྟ་མའེ་སོར་གི་རྗེ་ཨེ་སི་ཨེ་སི་ཀ་ཅི་ཨེ་ནས་སྨན་ཞབས་པའི་ལས་ཀ་ལ་འཛུལ་ཡོད་རེད། ཨེ་འདྲ་འདྲ་བོ་བྱས་བྱས་ནས་ང་ཚོ་གསུམ་རྦད་དེ་ལོགས་ཀ་ཆགས་རེད་ཡོད་བ།  ,e nas lha mo 'dra bor cha bzhag ba ra cig yin na/_mo rang da lta ma'e sor gi rje e si e si ka ci e nas sman zhabs pa'i las ka la 'dzul yod red/_e 'dra 'dra bo byas byas nas nga tsho gsum rbad de logs ka chags red yod ba/__,https://d38pmlk0v88drf.cloudfront.net/wav16k/STT_NS_M0243_0090_595810_to_604513.wav,STT_NS,3,188,8.703,wav16k/STT_NS_M0243_0090_595810_to_604513.wav,ཨེ་ནས་ལྷ་མོ་འདྲ་བོ་ཆ་བཞག་པ་ཡིན་ིན་ན་མོ་རང་ད་ལྟ་མའེ་སོར་གི་རྗས་ཨེསྀསཨཁ་ྗུ།་ཨེ་ནས་སྨན་ཞབས་པའི་ལས་ཀ་ལ་འཛུལ་ཡོད་རེད། ཨེ་འདྲའི་འདྲ་བོ་བྱས་བྱས་ནས་ང་ཚོ་གསུམ་རྦད་དེ་ལོགས་ཀ་ཆགས་རེད་ཡོད་བ།
STT_NS_M0238_0350_2354823_to_2357040,གཅིག་བྱས་གཉིས་བྱས་ལབ་ནས་ད་རྫུན་མ་རྫུན་མ་མགོ་སྐོར་ ,gcig byas gnyis byas lab nas da rdzun ma rdzun ma mgo skor _,https://d38pmlk0v88drf.cloudfront.net/wav16k/STT_NS_M0238_0350_2354823_to_2357040.wav,STT_NS,3,50,2.217,wav16k/STT_NS_M0238_0350_2354823_to_2357040.wav,གཅིག་བྱས་གཉིས་བྱས་ལབ་ནས་ད་རྫུན་མ་རྫུན་མ་མགོ་སྐོར།
STT_NS_M0241_0055_378494_to_381420,སྒྲ་ཕེབ་ལེན་བྱེད་དུས་ཙམ་པ་ད་ད་ལྟ་འདི་ངའི་ཀ་ཅི་འདི་ཚིག་དེ་གོ་ཡི་རེད་བ་ཨེ་ནས།  ,sgra pheb len byed dus tsam pa da da lta 'di nga'i ka ci 'di tshig de go yi red ba e nas/__,https://d38pmlk0v88drf.cloudfront.net/wav16k/STT_NS_M0241_0055_378494_to_381420.wav,STT_NS,3,77,2.926,wav16k/STT_NS_M0241_0055_378494_to_381420.wav,སྒྲ་ཕབ་ལེན་བྱེད་དུས་ཙམ་པ་ལ་ད་ད་ལྟ་འདི་ངའི་ཀ་ཅི་དི་ཚིག་དེ་གོ་གི་རཱ་ ཨེ་ནས།
STT_NS_M0245_0064_401527_to_404453,ཨེ་ནེ་ལགས་འདྲ་བོ་ཡིན་ན་ཨེ་ནས་ག་རེ་ལབ་དགོས་རེད། ནམ་རྒྱུན་ང་ཚོ་ ,e ne lags 'dra bo yin na e nas ga re lab dgos red/_nam rgyun nga tsho _,https://d38pmlk0v88drf.cloudfront.net/wav16k/STT_NS_M0245_0064_401527_to_404453.wav,STT_NS,3,62,2.926,wav16k/STT_NS_M0245_0064_401527_to_404453.wav,ཨ་ནེ་ལགས་འདྲ་བོ་ཡིན་ན་ཨེ་ནས་ག་རེ་ལབ་དགོས་རེད། ནམ་རྒྱུན་ང་ཚོ།
STT_NS_M0249_0126_1288728_to_1296527,ད་སོ་སོ། སོ་སོ་ཉོབ་བསྡད་ཡོད་ན་ཏིས་ཙི། ག་ལབ་དགོས་རེད་ད་ཆུང་ཆུང་སྐབས་སུ་ཉམས་ཆུང་ཆུང་ཡོད་རེད། ད་ཉམས་ཆུང་ཆུང་བྱས་ཨེ་ནས་ ,da so so/_so so nyob bsdad yod na tis tsi/_ga lab dgos red da chung chung skabs su nyams chung chung yod red/_da nyams chung chung byas e nas _,https://d38pmlk0v88drf.cloudfront.net/wav16k/STT_NS_M0249_0126_1288728_to_1296527.wav,STT_NS,3,116,7.799,wav16k/STT_NS_M0249_0126_1288728_to_1296527.wav,ད་སོ་སོ་སོ་སོ་ང་འདྲ་བོ་ཡིན་ན་ཏོག་ཙི་ག་རེ་ལབ་དགོས་རེད། ད་ཆུང་ཆུང་སྐབས་སུ་མཉམ་ཆུང་ཆུང་རེད་ཡོད་བ། ཨ་ནས་མཉམ་དུ་ཆུང་ཆུང་བྲས། ཨེ་ནས།
STT_TT00651_0249_2015127_to_2018131,བྱས་ཙང་ད། འགྲོ་བ་རིགས་དྲུག་དེ་ཚོའི་གྲས་དེ།  ,byas tsang da/_'gro ba rigs drug de tsho'i gras de/__,https://d38pmlk0v88drf.cloudfront.net/wav16k/STT_TT00651_0249_2015127_to_2018131.wav,STT_TT,3,44,3.004,wav16k/STT_TT00651_0249_2015127_to_2018131.wav,བྱས་ཙང་ད། འགྲོ་བ་རིགས་དྲུག་དེ་ཚོའི་གྲས་དེ།
STT_NS_M0238_0132_747076_to_749711,མེན་ཋཱལ་ཧེལ་ཐྀ་ལབ་ན་སྤྱིར་བཏང་ནས་ང་ཚོ་ཧེལ་ཐྀ་ལབ་དུས་ཙམ་པ་ལ།  ,men ThAl hel th-i lab na spyir btang nas nga tsho hel th-i lab dus tsam pa la/__,https://d38pmlk0v88drf.cloudfront.net/wav16k/STT_NS_M0238_0132_747076_to_749711.wav,STT_NS,3,61,2.635,wav16k/STT_NS_M0238_0132_747076_to_749711.wav,མེན་ཋལ་ཧེལཐྀ་ལབ་ན་སྤྱིར་བཏང་ནས་ང་ཚོ་ཧེལ་ཐྀ་ལབ་དུས་ཙམ་པ།
STT_NS_M0237_0454_2885145_to_2893455,ང་ཚོའི་དཔེ་ཆ་ནང་ནས་ཡང་འདི་འདི་འདྲའི་འདྲ་བོ་ཞེ་དྲགས་བཤད་ཀི་མ་རཱ། ག་རེ་བྱས་ན་འདོད་ཆགས་ཞེ་སྡང་འདི་ལ་ཨེ་ནས་གདོན་འདྲེ་ལབ་ནས་མིང་བཏགས་བ་མ་གཏོགས་ཅིག ,nga tsho'i dpe cha nang nas yang 'di 'di 'dra'i 'dra bo zhe drags bshad ki ma rA/_ga re byas na 'dod chags zhe sdang 'di la e nas gdon 'dre lab nas ming btags ba ma gtogs cig_,https://d38pmlk0v88drf.cloudfront.net/wav16k/STT_NS_M0237_0454_2885145_to_2893455.wav,STT_NS,3,142,8.31,wav16k/STT_NS_M0237_0454_2885145_to_2893455.wav,ང་ཚོའི་དཔེ་ཆ་ནང་ནས་ཡང་འདི་འདི་འདྲའི་འདྲ་བོ་ཞེ་དྲག་བྱེད་ཀི་མ་རེདབ། ག་རེ་བྱས་ལབ་ན། འདོད་ཆགས་ཞེ་སྡངས་འདི་ལ་ཨེ་ནས་གདོན་འདྲེ་ལབ་ནི་མིན་ད་མ་གཏོགས་ཅིག་གི
STT_TT00644_0097_993865_to_1000281,ད་རེད་དེ། ཁོང་དགེ་བསྙེན་རེད་བ། ད་དགེ་བསྙེན་ཡིན་པ་ཡིན་དུས་ཙམ་པ། ང་ག་དུས་མཇལ་ཁ་བཅར་ཡོང་དུས་ཙམ་པ་ཕྱག་ཕུལ་རེད་བ།  ,da red de/_khong dge bsnyen red ba/_da dge bsnyen yin pa yin dus tsam pa/_nga ga dus mjal kha bcar yong dus tsam pa phyag phul red ba/__,https://d38pmlk0v88drf.cloudfront.net/wav16k/STT_TT00644_0097_993865_to_1000281.wav,STT_TT,3,110,6.416,wav16k/STT_TT00644_0097_993865_to_1000281.wav,ད་རེད་དེ། ཁོང་དགེ་བསྙེན་རེད་བ། ད་དགེ་བསྙེན་ཡིན་པ་ཡིན་དུས་ཙམ་པ། ཡང་ག་དུས་མཇལ་ཁ་བཅར་ཡོང་དུས་ཙམ་པ། ཕྱག་ཕུལ་རེད་བ།
STT_NS_M0244_0094_609252_to_614836,ད་ང་འདྲ་བོ་ཡིན་ན་ཆུང་ཆུང་ནས་སྐབས་སུ་ཨ་ནས་ཕ་མ་གཉིས་ཀ་ཚོང་རྒྱག་གར་འགྲོ་ཨེ་འདྲའི་བྱས་ནས་སྤོ་བོ་རྨོ་མོས་གསོས་རྒྱོ་པུ་གུ་གཅིག་ཡིན་རཱ།  ,da nga 'dra bo yin na chung chung nas skabs su a nas pha ma gnyis ka tshong rgyag gar 'gro e 'dra'i byas nas spo bo rmo mos gsos rgyo pu gu gcig yin rA/__,https://d38pmlk0v88drf.cloudfront.net/wav16k/STT_NS_M0244_0094_609252_to_614836.wav,STT_NS,3,130,5.584,wav16k/STT_NS_M0244_0094_609252_to_614836.wav,ད་ང་འདྲ་བོ་ཡིན་ན་ཆུང་ཆུང་ནས་སྐབས་སུ་ཨེ་ནས་ཕ་མ་གཉིས་ཀ་ཚོང་རྒྱག་གར་འགྲོ་ཨེ་འདྲའི་བྱས་ནས་སྤོ་སྤོ་རྨོ་མོ་གསོས་རྒྱོ་བུ་གུ་གཅིག་ཡིན་རཱ།
STT_NS_M0246_0084_520998_to_526680,ཨ་མ་ལགས་ངར་པེ་ཤ་རྫོགས་སོང་ཨ་ནས་དངུལ་ཏིས་སི་གཏང་རོགས་བྱེད་དང་ཡང་མེད་ན་ཇོ་ཇོ་ཨ་ཅག་ངར་པེ་ཤ་རྫོགས་སོང་དངུལ་ཏིས་སི་གཏང་རོགས་བྱེད་དང་ལབ་ནས་ཨེ་འདྲའི་ལབ་ཀི་རཱ་ད།  ,a ma lags ngar pe sha rdzogs song a nas dngul tis si gtang rogs byed dang yang med na jo jo a cag ngar pe sha rdzogs song dngul tis si gtang rogs byed dang lab nas e 'dra'i lab ki rA da/__,https://d38pmlk0v88drf.cloudfront.net/wav16k/STT_NS_M0246_0084_520998_to_526680.wav,STT_NS,3,155,5.682,wav16k/STT_NS_M0246_0084_520998_to_526680.wav,ཨ་མ་ལགས་ང་པེ་ཤ་རྫོགས་སོང་། ཨ་ནས་དངུལ་ཏིག་ཙི་གཏང་རོགས་བྱིས་དང་། ཡང་མིན་ན་ཇོ་ཇོ་ཨ་ཅག་ང་པེ་ཤག་རྫོགས་སོང་དངུལ་ཏིས་ཙི་བཏང་རོགས་བྱས་དང་ལབ་ནཨེ་འདྲའི་ལབ་ཀི་རཱ་ད།
STT_NS_M0238_0465_3135708_to_3143165,ད་སོ་སོ་ལ་ཡེ་ཕན་གི་རེད། གཞན་པ་སློབ་ཕྲུག་དེ་ཚོ་ལ་ཕན་གི་རེད། དགེ་ལས་ཚང་མ་ལ་ཕན་གི་རེད་རཱ། ད་སོ་སོ་ཕྱོགས་གཅིག་ནས་ལབ་ན་བསོད་ནམས་རང་རེད་འདུག་བ།་ ,da so so la ye phan gi red/_gzhan pa slob phrug de tsho la phan gi red/_dge las tshang ma la phan gi red rA/_da so so phyogs gcig nas lab na bsod nams rang red 'dug ba/ _,https://d38pmlk0v88drf.cloudfront.net/wav16k/STT_NS_M0238_0465_3135708_to_3143165.wav,STT_NS,3,139,7.457,wav16k/STT_NS_M0238_0465_3135708_to_3143165.wav,ད་སོ་སོ་ལ་ཕན་གི་རེད། གཞན་པ་སློབ་ཕྲུག་དེ་ཚོ་ལ་ཕན་གི་རེད། རྒན་ལགས་ཚང་མ་ལ་ཕན་གི་རེད་རཱ། ད་སོ་སོ་ཕྱོགས་གཅིག་ནས་ལྟ་ན་བསོད་ནམས་རང་རེད་འདུག་བ།
STT_NS_M0237_0506_3239394_to_3243110,མོ་ང་ཨེ་འདྲ་དྲན་གི་མི་འདུག ང་ཚོའི་མི་མང་ཆེ་བས་ཨེ་འདྲའི་ལབ་ཀི་འདུག་བ།  ,mo nga e 'dra dran gi mi 'dug_nga tsho'i mi mang che bas e 'dra'i lab ki 'dug ba/__,https://d38pmlk0v88drf.cloudfront.net/wav16k/STT_NS_M0237_0506_3239394_to_3243110.wav,STT_NS,3,70,3.716,wav16k/STT_NS_M0237_0506_3239394_to_3243110.wav,མོ་ང་ཡ་ཨེ་འདྲའི་བྱེད་ཀི་མི་འདུག ང་ཚོས་མི་མང་ཆེ་ཨེ་འདྲའི་ལབ་ཀི་འདུག་བ།
STT_NS_M0246_0229_1470093_to_1472439,ང་ཨེ་འདྲའི་འདྲ་བོ་ད་ང་རང་བུ་མོ་ཅིག་ཡིན་པའི་ཆ་ནས་ང་ནི་ཨེ་འདྲའི།  ,nga e 'dra'i 'dra bo da nga rang bu mo cig yin pa'i cha nas nga ni e 'dra'i/__,https://d38pmlk0v88drf.cloudfront.net/wav16k/STT_NS_M0246_0229_1470093_to_1472439.wav,STT_NS,3,64,2.346,wav16k/STT_NS_M0246_0229_1470093_to_1472439.wav,ང་ཨེ་འདྲའི་འདྲ་བོ་ད་ང་རང་བུ་མོ་གཅིག་ཡིན་པའི་ཆ་ནས་ང་ནི་ཨེ་འདྲའི།
STT_TT00676_0034_195127_to_201970,གཞུག་གུ་ཨ་ལྟ་ག་རེ་ཟེ་ཨ། བདག་གཞན་མཉམ་པ་དེ་རྒྱས་པར་བཤད་ཡ་ཡིན་དུས། དེའི་ནང་ལ་སླེབ་ཀི་ཡོད་ཙང་འགྲིག་གི་འདུག་བསམ་པ་འདུག ,gzhug gu a lta ga re ze a/_bdag gzhan mnyam pa de rgyas par bshad ya yin dus/_de'i nang la sleb ki yod tsang 'grig gi 'dug bsam pa 'dug_,https://d38pmlk0v88drf.cloudfront.net/wav16k/STT_TT00676_0034_195127_to_201970.wav,STT_TT,3,114,6.843,wav16k/STT_TT00676_0034_195127_to_201970.wav,ཤོག་གུ་ཨ་ལྟ་ག་རེ་ཟ། བདག་གཞན་མཉམ་པ་དེ་རྒྱས་པར་བཤད་ཡ་ཡིན་དུས། དེའི་ནང་ལ་སླེབ་ཀི་ཡོད་ཙང་འགྲིག་གི་འདུག་བསམ་པ་འདུག
STT_TT00694_0403_2638660_to_2642636,བློ་སྦྱོང་ཉམས་ལེན་གྱིས་ཁྱད་པར་བྱས་ཟེ། ཨ་པོ་ད་ཞེ་བོ་གསུངས་སོང་ང་།  ,blo sbyong nyams len gyis khyad par byas ze/_a po da zhe bo gsungs song nga /__,https://d38pmlk0v88drf.cloudfront.net/wav16k/STT_TT00694_0403_2638660_to_2642636.wav,STT_TT,3,66,3.976,wav16k/STT_TT00694_0403_2638660_to_2642636.wav,བློ་སྦྱོང་ཉམས་ལེན་གྱིས་ཁྱད་པར་བྱསད་ཟེ། ཨ་པོ།་ད་ཞེ་བོ་གསུངས་སོང་བ།
