file_name,uni,wylie,url,dept,grade,char_len,audio_len,path,inf
STT_TT00626_0018_155247_to_160230,ཨེ། དགེ་ལུགས་ནང་ལ་ད་བསྟེན་ངེ་ཁ་ཤས་ཁ་ཤས་བྱུང་པ་ཡིན་པ་རེད། ཨེ་ནས་ས་སྐྱའི་ནང་ལ་ཁ་ཤས་ཁ་ཤས་བྱུང་བ་ཡིན་པ་རེད།  ,e/_dge lugs nang la da bsten nge kha shas kha shas byung pa yin pa red/_e nas sa skya'i nang la kha shas kha shas byung ba yin pa red/__,https://d38pmlk0v88drf.cloudfront.net/wav16k/STT_TT00626_0018_155247_to_160230.wav,STT_TT,3,105,4.983,wav16k/STT_TT00626_0018_155247_to_160230.wav,ཨ། དགེ་ལུགས་ནང་ལ་ད་བལྟན་ངེ་ཁ་ཤས་ཁ་ཤས་བྱུང་བ་ཡིན་པ་རེད། ཨེ་ནས་ས་སྐྱའི་ནང་ལ་ཁ་ཤས་ཁ་ཤས་བྱུང་བ་ཡིན་པ་རེད།
STT_TT00642_0114_1258164_to_1260564,ཏིང་ངེ་འཛིན་གི་བསླབ་པ། ཤེས་རབ་ཀི་བསླབ་པ་ཟེ། བསླབ་པ་གསུམ།  ,ting nge 'dzin gi bslab pa/_shes rab ki bslab pa ze/_bslab pa gsum/__,https://d38pmlk0v88drf.cloudfront.net/wav16k/STT_TT00642_0114_1258164_to_1260564.wav,STT_TT,3,58,2.4,wav16k/STT_TT00642_0114_1258164_to_1260564.wav,ཏིང་ངེ་འཛིན་གི་བསླབ་པ། ཤེས་རབ་ཀི་བསླབ་པ་ཟེ། བསླབ་པ་གསུམ།
STT_TT00635_0060_462502_to_465126,ཨ། སྐྱེས་པ་དང་བུད་མེད་གཉིས་ཀའི་ལུས་ལ་སྦྱར་པ་ཡིན་ན། རེད་བ།  ,a/_skyes pa dang bud med gnyis ka'i lus la sbyar pa yin na/_red ba/__,https://d38pmlk0v88drf.cloudfront.net/wav16k/STT_TT00635_0060_462502_to_465126.wav,STT_TT,3,59,2.624,wav16k/STT_TT00635_0060_462502_to_465126.wav,ཨ། སྐྱེས་པ་དང་བུད་མེད་གཉིས་ཀའི་ལུགས་ལ་སྦྱར་པ་ཡིན་ན། རེད་བ།
STT_TT00634_0002_32534_to_35298,ཁ་སང་ང་ཚོས། ཡ་གི་མགོ་དེ་ནས། སེམས་སྲུང་བ་ཟེར་ཡ་ཅིག ,kha sang nga tshos/_ya gi mgo de nas/_sems srung ba zer ya cig_,https://d38pmlk0v88drf.cloudfront.net/wav16k/STT_TT00634_0002_32534_to_35298.wav,STT_TT,3,50,2.764,wav16k/STT_TT00634_0002_32534_to_35298.wav,ཁ་སང་ང་ཚོ་ཡ་གི་མགོ་དེ་འདྲའི་ སེམས་སྲོང་བ་ཟེར་ཡ་ཅིག
STT_TT00632_0086_930332_to_935537,ད་དེ། ང་ཚོས་དེ་གསུང་གི་ཡོད་རེད་བ། ཤིང་ཏོག་ལ་དཔེ་སྦྱར་ནས། ཤིང་ཏོག་ཨ་མྲ་ཟེ་དུས། ང་ཚོའི་ཨམྲ་འདྲ་བོ་ཡིན་ས་རེད།  ,da de/_nga tshos de gsung gi yod red ba/_shing tog la dpe sbyar nas/_shing tog a mra ze dus/_nga tsho'i amra 'dra bo yin sa red/__,https://d38pmlk0v88drf.cloudfront.net/wav16k/STT_TT00632_0086_930332_to_935537.wav,STT_TT,3,108,5.205,wav16k/STT_TT00632_0086_930332_to_935537.wav,ད་དེ་ང་ཚོས་དེ་གསུང་གི་ཡོད་རེད་བ། ཤིང་ཏོག་ལ་དཔེ་སྦྱར་ནས། ཤིང་ཏོག་ཨ་མ་ཟེར་དུས། ང་ཚོ་ཨཾ་འདྲ་བོ་ཡིན་ས་རེད།
STT_NS_M0285_0156_866232_to_868333,ག་བར་ཡོད་རྒྱོ། དགོས་དགོས་ཡ་དེ་ཚོ།  ,ga bar yod rgyo/_dgos dgos ya de tsho/__,https://d38pmlk0v88drf.cloudfront.net/wav16k/STT_NS_M0285_0156_866232_to_868333.wav,STT_NS,3,35,2.101,wav16k/STT_NS_M0285_0156_866232_to_868333.wav,ག་བ་ཡོད་རྒྱོ་ དགོས་དགོས་ཡ་དེ་ཚོ།
STT_TT00625_0233_1684837_to_1692414,བཅོམ་ལྡན་འདས་ཀི་གསུང་དེའི་རྗེས་སུ་འབྲངས་ནས། ཀླུ་སྒྲུབ་ཡབ་སྲས་ལ་སོགས་པ་དེ་ཚོའི་གྲས་ཀིས་སངས་རྒྱས་ཀི་གསུང་། རིགས་ཅིག་དེ་དགག་པ་བསྐྱོན་ནས་བཀག་བཞག་ཡོད་རེད།  ,bcom ldan 'das ki gsung de'i rjes su 'brangs nas/_klu sgrub yab sras la sogs pa de tsho'i gras kis sangs rgyas ki gsung /_rigs cig de dgag pa bskyon nas bkag bzhag yod red/__,https://d38pmlk0v88drf.cloudfront.net/wav16k/STT_TT00625_0233_1684837_to_1692414.wav,STT_TT,3,151,7.577,wav16k/STT_TT00625_0233_1684837_to_1692414.wav,བཅོམ་ལྡན་འདས་ཀི་གསུང་དེ་རྗེས་སུ་འབྲངས་ནས། ཀླུ་སྒྲུབ་ཡབ་སྲས་ལ་སོགས་པ་དེ་ཚོའི་གྲས་ཀིས། སངས་རྒྱས་ཀི་གསུང་། རིགས་གཅིག་དེ། དགག་པ་བསྐྱོན་ནས་བཀག་བཞག་ཡོད་རེད།
STT_TT00672_0066_504087_to_509257,སྙིང་རྗེ་གི་བསམ་བློ་གཏང་མཁན་ཅིག སྙིང་རྗེ་ཉམས་ལེན་བྱེད་མྱི་ཅིག་ཡིན་ན། འདི་མགོ་འཚོས་དགོས་ཀི་འདུག་བ་ད།  ,snying rje gi bsam blo gtang mkhan cig_snying rje nyams len byed myi cig yin na/_'di mgo 'tshos dgos ki 'dug ba da/__,https://d38pmlk0v88drf.cloudfront.net/wav16k/STT_TT00672_0066_504087_to_509257.wav,STT_TT,3,101,5.17,wav16k/STT_TT00672_0066_504087_to_509257.wav,སྙིང་རྗེ་གི་བསམ་བློ་གཏང་མཁན་ཅིག སྙིང་རྗེ་ཉམས་ལེན་བྱེད་ངེ་ཅིག་ཡིན་ན། དེ་མགོ་ཚོད་དགོས་ཀི་འདུག་ག་ད།
STT_TT00624_0132_897581_to_907312,སྐྱོན་ཅིག་མཐོང་པ་ཡིན་ན། འགལ་འདུ་ཅིག་མཐོང་བ་ཡིན་ན། དེ་བཅོམ་ལྡན་འདས་ཀི་གསུང་དེ། ཨེ་ནས། དགོས་པའི་དབང་གིས་གསུངས་པ་རེད་མ་གཏོགས། སྒྲ་ཇི་བཞིན་པ་ཁས་བླང་དགོས་མ་རེད་ཟེ་བྱས་ནས། ད་བཤད་ཡ་ཅིག བཅོམ་ལྡན་འདས་ཀིས་གནང་འདུག་ག ,skyon cig mthong pa yin na/_'gal 'du cig mthong ba yin na/_de bcom ldan 'das ki gsung de/_e nas/_dgos pa'i dbang gis gsungs pa red ma gtogs/_sgra ji bzhin pa khas blang dgos ma red ze byas nas/_da bshad ya cig_bcom ldan 'das kis gnang 'dug ga_,https://d38pmlk0v88drf.cloudfront.net/wav16k/STT_TT00624_0132_897581_to_907312.wav,STT_TT,3,206,9.731,wav16k/STT_TT00624_0132_897581_to_907312.wav,སྐྱོན་ཅིག་མཐོང་པ་ཡིན་ན། འགལ་འདུ་ཅིག་མཐོང་པ་ཡིན་ན། དེ་བཅོམ་ལྡན་འདས་ཀི་གསུང་དེ། ཨེ་ནས་དགོས་པའི་དབང་གིས་གསུངས་པ་རེད་མ་གཏོགས། སྒྲ་ཇི་བཞིན་པ་ཁས་བླང་དགོས་མ་རེད་ཟེ་བྱས་ནས་ ད་བཤད་ཡ་ཅིག་བཅོམ་ལྡན་འདས་ཀིས་གནང་འདུག་ག
STT_TT00628_0096_719411_to_722675,དངོས་གནས་བྱས་ན། སྡུག་ས་དེ་ལ་བརྟེན་དགོས་ཀི་ཡོད། སྡུག་ས་དེ། སྐྱབས་ཡ་གི་ཐབས་ཤེས་བྱེད་དགོས་ཀི་ཡོད་རེད་བ།  ,dngos gnas byas na/_sdug sa de la brten dgos ki yod/_sdug sa de/_skyabs ya gi thabs shes byed dgos ki yod red ba/__,https://d38pmlk0v88drf.cloudfront.net/wav16k/STT_TT00628_0096_719411_to_722675.wav,STT_TT,3,102,3.264,wav16k/STT_TT00628_0096_719411_to_722675.wav,དངོས་གནས་བྱས་ན། སྡུག་ས་དེ་ལ་བརྟེན་དགོས་ཀི། སྡུག་ས་དེ་སྐྱབ་ཡ་གི་ཐབས་ཤེས་བྱེད་དགོས་ཀི་ཡོད་རེད་།
STT_TT00623_0104_941715_to_950930,དེ་འདྲའི་དྲན་མྱོང་། སཱ། དེ་འདྲའི་ཡིན་དུས་ཙ་ནས། ཁོ་གང་ལྟར། དེ་དུས་ཧོབ་དེ་ཁ་ལ་ཡ། ཨེ། ཡུ་རོབ་དེ། ཕེ་སི་ཟོལ་འདྲ་བོ་ཅིག་ཡོད་རེད་དེ། དེའི་ཕེ་སི་དེ། ཨ་ཧྥི་ཋར་ཨོ་ཧྥི་ཧྥེར།  ,de 'dra'i dran myong /_sA/_de 'dra'i yin dus tsa nas/_kho gang ltar/_de dus hob de kha la ya/_e/_yu rob de/_phe si zol 'dra bo cig yod red de/_de'i phe si de/_a h+phi Thar o h+phi h+pher/__,https://d38pmlk0v88drf.cloudfront.net/wav16k/STT_TT00623_0104_941715_to_950930.wav,STT_TT,3,165,9.215,wav16k/STT_TT00623_0104_941715_to_950930.wav,དེ་འདྲའི་དྲན་མྱོང་། ཙཙ་དེ་འདྲའི་ཡིན་དུས་ཙ་ནས། ཁོ་གང་ལྟར། དེ་དུས་ ཧོབ་སྟེ་ཁ་ལ་ཡ། ཨེ། ཡོ་རོབ་དེ། ཕིསི་ཟོལ་འར་བོ་ཅིག་ཡོད་རེད་དེ། དེ་ཕི་སི་དེ་ཨབ་ཋོབ་ཧྥི་ཨ།
STT_TT00633_0083_818916_to_825674,བགྲོ་གླེང་གནང་བཞག་པ་ཅིག གནང་ཡོང་དུས་སྒང་ལ། ད་དེ། བགྲོ་གླེང་གནང་ཡོང་དུས། འབྲོམ་སྟོན་པ་གིས་ཐ་མ་དེ་ལ། སྒོམ་བརྒྱབ་ཡོང་དུས།  ,bgro gleng gnang bzhag pa cig_gnang yong dus sgang la/_da de/_bgro gleng gnang yong dus/_'brom ston pa gis tha ma de la/_sgom brgyab yong dus/__,https://d38pmlk0v88drf.cloudfront.net/wav16k/STT_TT00633_0083_818916_to_825674.wav,STT_TT,3,120,6.758,wav16k/STT_TT00633_0083_818916_to_825674.wav,བགྲོ་གླེང་གནང་བཞག་པ་ཅིག་གནང་ཡོང་དུས་སྒང་ལ། ད་དེ་བགྲོ་གླེང་གནང་ཡོང་དུས། འབྲོམ་སྟོམ་པ་གིས་མཐའ་མ་དེ་ལ་སྡོམ་བརྒྱབ་ཡོང་དུས།
STT_TT00627_0264_2327141_to_2329829,ཨ། དཔེར་ན། སེར་སྣ་ཚ་བོ་ཡོད་བསྡད་ངེ་དེ་འདྲ་གི་མི་དེ་འདྲའི།  ,a/_dper na/_ser sna tsha bo yod bsdad nge de 'dra gi mi de 'dra'i/__,https://d38pmlk0v88drf.cloudfront.net/wav16k/STT_TT00627_0264_2327141_to_2329829.wav,STT_TT,3,59,2.688,wav16k/STT_TT00627_0264_2327141_to_2329829.wav,ཨ། དཔེར་ན། ཟ་སྣ་ཚ་པོ་ཡོད་བསྡད་ྱེ་དེ་འདྲའ་གི། མི་དེ་འདྲའི།
STT_TT00634_0130_1022745_to_1025817,ད་ཁ་དོག་བཟང་པོ་མཐོང་གི་མེད་འགྲོ། དེར་མཆོམ་ནས་སྲོག་ཤོར་འགྲོ་གི་ཡོད་རཱ།  ,da kha dog bzang po mthong gi med 'gro/_der mchom nas srog shor 'gro gi yod rA/__,https://d38pmlk0v88drf.cloudfront.net/wav16k/STT_TT00634_0130_1022745_to_1025817.wav,STT_TT,3,71,3.072,wav16k/STT_TT00634_0130_1022745_to_1025817.wav,ད་ཁ་དོག་བཟང་པོ་མཐོང་གི་མིན་འགྲོ། དེ་མཆོང་ནས་སྲོག་ཤོར་འགྲོ་གི་ཡོད་རེད་བ།
STT_TT00642_0112_1239479_to_1241510,ད་མྱང་འདས་མྱུར་དུ་སྒྲུབ་དགོས་པ་ཟེ།  ,da myang 'das myur du sgrub dgos pa ze/__,https://d38pmlk0v88drf.cloudfront.net/wav16k/STT_TT00642_0112_1239479_to_1241510.wav,STT_TT,3,36,2.031,wav16k/STT_TT00642_0112_1239479_to_1241510.wav,ཨོ། ད་མྱང་འདས་མྱུར་དུ་སྒྲུབ་དགོས་པ་ཟེ།
STT_TT00631_0028_204769_to_207425,ཐེག་ཆེན་ཐུན་མོང་མ་ཡིན་པའི་ལམ་ཉམས་ལེན་བྱེད་སྟངས་ཀི་རིམ་པ་གསུང་གི་ཡོད་རེད།  ,theg chen thun mong ma yin pa'i lam nyams len byed stangs ki rim pa gsung gi yod red/__,https://d38pmlk0v88drf.cloudfront.net/wav16k/STT_TT00631_0028_204769_to_207425.wav,STT_TT,3,74,2.656,wav16k/STT_TT00631_0028_204769_to_207425.wav,དེ་རྗེས་ཐུན་མོང་མ་ཡིན་པའི་ ལམ་ཉམས་ལེན་བྱེད་སྟངས་ཀི་རིམ་པ་གསུང་གི་ཡོད་རེད།
STT_TT00642_0001_26988_to_32244,ཡ་ད་ང་ཚོ་འདི་ནས་མར་ཅིག་ཞུས་བཞག་དགོས་རེད་བ། ཡིན་དུས་ད་དེ་ཆ་ཚང་གཅིག་འགྲོ་ས་མ་རེད། ཝེ། མཚམས་གཅིག་བཞད་ན་མ་གཏོགས།  ,ya da nga tsho 'di nas mar cig zhus bzhag dgos red ba/_yin dus da de cha tshang gcig 'gro sa ma red/_we/_mtshams gcig bzhad na ma gtogs/__,https://d38pmlk0v88drf.cloudfront.net/wav16k/STT_TT00642_0001_26988_to_32244.wav,STT_TT,3,110,5.256,wav16k/STT_TT00642_0001_26988_to_32244.wav,ཡ་ད་ང་ཚོ་འདི་ནས་མར་ཅིག་ཞུས་བཞག་གོ་རེད་བ། ཡིན་དུས་ད་དེ། ཆ་ཚང་ཅིག་འགྲོ་ས་མ་རེད། ཡི མཚམས་ཅིག་བཞག་ན་མ་གཏོགས།
STT_TT00628_0003_40520_to_48165,མི་སྙན་ཚིག་རྣམས་རྣ་བར་བྱུང་བ་ན། ཕྲ་མ་ལ་སོགས་ངག་གི་ཉེས་པ་ཡིས། ལས་ངན་མཚོན་ཆ་རང་ལ་འཁོར་བ་ཡི། ད་ནི་ངག་གི་སྐྱོན་ལ་སྨད་པར་བྱ། ཟེ།  ,mi snyan tshig rnams rna bar byung ba na/_phra ma la sogs ngag gi nyes pa yis/_las ngan mtshon cha rang la 'khor ba yi/_da ni ngag gi skyon la smad par bya/_ze/__,https://d38pmlk0v88drf.cloudfront.net/wav16k/STT_TT00628_0003_40520_to_48165.wav,STT_TT,3,125,7.645,wav16k/STT_TT00628_0003_40520_to_48165.wav,མེ་ཉན་ཚིག་རྣམས་སྣང་བར་བྱུང་བ་ན། ཕྲ་མ་ལ་སོགས་ངག་གི་ཉེས་པ་ཡིས། ལས་ངན་མཚོན་ཆ་རང་ལ་འཁོར་བ་ཡིས། ད་ནི་ངག་གི་སྐྱོན་ལ་སྨད་པར་བྱ། ཟེ།
STT_TT00622_0478_3312448_to_3315072,ཡང་དེ་འདྲའི་གི། ད་དམིགས་བསལ་ཀི། ཨེ་ནས།  ,yang de 'dra'i gi/_da dmigs bsal ki/_e nas/__,https://d38pmlk0v88drf.cloudfront.net/wav16k/STT_TT00622_0478_3312448_to_3315072.wav,STT_TT,3,40,2.624,wav16k/STT_TT00622_0478_3312448_to_3315072.wav,ཡང་དེ་འདྲའི་གི་ད་དམིགས་བསལ་གི། ཨེ་ནས།
STT_TT00627_0349_3026884_to_3029284,ལན། ག་རེ་སྐྱེ་གོ་རེད་ཟེ། ཆགས་པ་ད་ཞེ་སྡང་གཉིས་སྐྱེ་དགོས་ཀི་རེད།  ,lan/_ga re skye go red ze/_chags pa da zhe sdang gnyis skye dgos ki red/__,https://d38pmlk0v88drf.cloudfront.net/wav16k/STT_TT00627_0349_3026884_to_3029284.wav,STT_TT,3,64,2.4,wav16k/STT_TT00627_0349_3026884_to_3029284.wav,ལན་ག་རེ་སྐྱེ་དགོས་རེད་ཟེ་། ཆགས་པ་དང་ཞེ་སྡང་གཉིས་སྐྱེ་ཡོང་གོ་རེད།
STT_TT00631_0030_217909_to_220341,ད་ཕ་རོལ་ཏུ་ཕྱིན་པ་ཟེ་དུས། སྤྱིར་བཏང་སངས་རྒྱས་ཟེ་གི་ཡོད་རེད།  ,da pha rol tu phyin pa ze dus/_spyir btang sangs rgyas ze gi yod red/__,https://d38pmlk0v88drf.cloudfront.net/wav16k/STT_TT00631_0030_217909_to_220341.wav,STT_TT,3,61,2.432,wav16k/STT_TT00631_0030_217909_to_220341.wav,ད་ཕ་རོལ་ཏུ་ཕྱིན་པ་ཟེར་དུས། སྤྱིར་བཏང་སངས་རྒྱས་ཟེར་གི་ཡོད་རེད།
STT_TT00622_0356_2506288_to_2509564,ད་ག ལག་ལེན་ག་ཚད་སེ། བཀལ་ཐུབ་བྲོར་ཡོད་མེད་ནི། ཤེས་ཀི་མ་རེད་བ། ད།  ,da ga_lag len ga tshad se/_bkal thub bror yod med ni/_shes ki ma red ba/_da/__,https://d38pmlk0v88drf.cloudfront.net/wav16k/STT_TT00622_0356_2506288_to_2509564.wav,STT_TT,3,65,3.276,wav16k/STT_TT00622_0356_2506288_to_2509564.wav,ད་ག ལག་ལེན་ག་ཚོད་ཙི་སྐྱེལ་ཐུབ་རྲ་ཡོད་མེན་ནི།་ཤེས་ཀི་མ་རེད་བ་ད།
STT_TT00629_0049_256925_to_260157,ང་རག་ལས་རེད། རེད་བ། སྐྱེ་བ་སྔོན་མ་གི་ད་གཡུགས་ཚར་རེད། ད་ལྟ་བར་དུ་གཡུགས་ཡོད་རེད། རེད་བ།  ,nga rag las red/_red ba/_skye ba sngon ma gi da g.yugs tshar red/_da lta bar du g.yugs yod red/_red ba/__,https://d38pmlk0v88drf.cloudfront.net/wav16k/STT_TT00629_0049_256925_to_260157.wav,STT_TT,3,87,3.232,wav16k/STT_TT00629_0049_256925_to_260157.wav,ང་རང་ལས་རེད། རེད་བ། སྐྱེ་བ་སྔོན་མ་གིས་ད་གཡུགས་ཚར་རེད། ད་ལྟ་བར་དུ་གཡུག་ི་ཡོད་རེད། རེད་བ།
STT_TT00629_0105_617073_to_626493,ད་ལྟ་ཉམས་ལེན་བྱས། དེ་བསྟེན་པ་ཡིན་ན། དེ་ནས། སོ་སོ་སྐྱེ་བ་ཕྱི་མ་ཕན་ཆད་ལ་ཡ། དཀོན་མཆོག་མདུན་ལ་གསོལ་བ་བཏབ་ཡ་དེ། གསོལ་བ་ཐེབས་ཡ་ཅིག དེ་ནས་ཅིག དོན་འགྲུབ་ཡ་ཅིག བར་ཆད་སངས་འགྲོ་ཡ་ཅིག ,da lta nyams len byas/_de bsten pa yin na/_de nas/_so so skye ba phyi ma phan chad la ya/_dkon mchog mdun la gsol ba btab ya de/_gsol ba thebs ya cig_de nas cig_don 'grub ya cig_bar chad sangs 'gro ya cig_,https://d38pmlk0v88drf.cloudfront.net/wav16k/STT_TT00629_0105_617073_to_626493.wav,STT_TT,3,172,9.42,wav16k/STT_TT00629_0105_617073_to_626493.wav,ད་ལྟ་ཉམས་ལེན་བྱས། དེ་བསྟན་པ་ཡིན་ན། དེ་ནས། སོ་སོས་སྐྱེ་བ་ཕྱི་མ་ཕན་ཆད་ལ་ཡ། དཀོན་མཆོག་མདུན་ལ་གསོལ་བ་བཏབ་ཡ་ད། གསོལ་བ་ཐེབས་ཡ་ཅིག དེ་ནས་ཅིག་དོན་སྒྲུབ་ཡ་ཅིག བར་ཆད་བསག་འགྲོ་ཡ་ཅིག
STT_TT00636_0180_1158472_to_1165878,མི་གཞན་གི་བསྙེན་བཀུར། མི་གཞན་གི་བཀུར་སྟི། དེ་ནས་སྙན་གྲགས། དེ་འདྲའི་གི་དྲི་མས་མ་གོས་པ། དེ་ནས།  ,mi gzhan gi bsnyen bkur/_mi gzhan gi bkur sti/_de nas snyan grags/_de 'dra'i gi dri mas ma gos pa/_de nas/__,https://d38pmlk0v88drf.cloudfront.net/wav16k/STT_TT00636_0180_1158472_to_1165878.wav,STT_TT,3,94,7.406,wav16k/STT_TT00636_0180_1158472_to_1165878.wav,མི་གཞན་གི་བསྙེན་བཀུར། མི་གཞན་གི་བཀུར་སྟེ། དེ་ནས་སྙན་གྲགས། དེ་འདྲའ་གི་དྲན་མས་མ་གོས་པ། དེ་ནས།
STT_TT00631_0163_1546806_to_1548950,ད་ཅིག་གི་གཞན་གིས་གནོད་འཚེ་བྱས་ཡོད་ནས་འདྲ་འདུག ,da cig gi gzhan gis gnod 'tshe byas yod nas 'dra 'dug_,https://d38pmlk0v88drf.cloudfront.net/wav16k/STT_TT00631_0163_1546806_to_1548950.wav,STT_TT,3,46,2.144,wav16k/STT_TT00631_0163_1546806_to_1548950.wav,ད་ཅིག་གི གཞན་གིས་གནོད་འཚེ་བྱས་ཡོད་ནས་འདྲ་འདུག
STT_TT00643_0144_1511778_to_1514978,འཁོར་བ་ཇི་སྲིད་གནས་པ་དེ་སྲིད་དུ། སོ་སོ་གནས་ཐུབ་ཡ་གི་ནུས་པ་ཅིག་ཡོད་རེད་བས་ཟེ་ན། ཡོད་མ་རེད་བ།  ,'khor ba ji srid gnas pa de srid du/_so so gnas thub ya gi nus pa cig yod red bas ze na/_yod ma red ba/__,https://d38pmlk0v88drf.cloudfront.net/wav16k/STT_TT00643_0144_1511778_to_1514978.wav,STT_TT,3,93,3.2,wav16k/STT_TT00643_0144_1511778_to_1514978.wav,འཁོར་བ་ཇི་སྲིད་གནས་པ་དེ་སྲིད་དུ། སོ་སོའ་གནས་ཐུབ་ཡ་གི་ནུས་པ་ཅིག་ཡོད་རེད་ཟེ། ཡོད་མ་རེད་བ།
STT_TT00633_0205_1972505_to_1975033,ཉོན་མོངས་སྐྱེ་སའི་ཡུལ་དང་། ག་ཚད་ཐག་རིང་ག་བསྟེན་དགོས་ཀི་རེད་ཟེ།  ,nyon mongs skye sa'i yul dang /_ga tshad thag ring ga bsten dgos ki red ze/__,https://d38pmlk0v88drf.cloudfront.net/wav16k/STT_TT00633_0205_1972505_to_1975033.wav,STT_TT,3,64,2.528,wav16k/STT_TT00633_0205_1972505_to_1975033.wav,ཉོན་མོངས་སྐྱེ་སའི་ཡུལ་དང་ག་ཚད་ཐག་རིང་བ་བརྟེན་དགོས་ཀི་རེད་ཟེ།
STT_TT00642_0203_2342022_to_2347755,ད་ཨེ་ནས། སྡུག་བསྔལ་དེའི་རྩ་བ་དེ་འགག་པར་བྱེད་པ་ལ། འགག་ཡ་གི་རྒྱུ་གཙོ་བོ་དེ་ག་རེད་ལབ་ན།  ,da e nas/_sdug bsngal de'i rtsa ba de 'gag par byed pa la/_'gag ya gi rgyu gtso bo de ga red lab na/__,https://d38pmlk0v88drf.cloudfront.net/wav16k/STT_TT00642_0203_2342022_to_2347755.wav,STT_TT,3,86,5.733,wav16k/STT_TT00642_0203_2342022_to_2347755.wav,ད་ཨེ་ནས། སྡུག་བསྔལ་དེ་རྩ་བ་དེ་དགག་པར་བྱེད་པ་ལ། དགག་ཡ་གི་རྒྱུ་གཙོ་བོ་དེ་ག་རེ་རེད་ལབ་ན།
STT_TT00643_0067_554100_to_556660,སོ་སོ་གི་མི་ཚེ་གཅིག་སྐྱེལ་སྟངས་གང་འདྲའི་སྐྱེལ་དགོས་རེད་ལབ་ན། འདི་རེད་ཤག ,so so gi mi tshe gcig skyel stangs gang 'dra'i skyel dgos red lab na/_'di red shag_,https://d38pmlk0v88drf.cloudfront.net/wav16k/STT_TT00643_0067_554100_to_556660.wav,STT_TT,3,72,2.56,wav16k/STT_TT00643_0067_554100_to_556660.wav,སོ་སོ་གི་མི་ཚེ་ཅིག་སྐྱེལ་སྟངས་ག་འདྲའི་སྐྱེལ་དགོས་རེད་ལབ་ན། དེ་རེད་ཤག
STT_TT00626_0048_359820_to_364906,ཨེ་ནས་མེ། བོད་བསྟན་སྲིད་སྤྱིའི་དོན་དག་ལ་དམིགས་ནས་ཅིག་བསྟེན་གསོལ་བྱེད་ཡ་འདྲ་བོ་བྱས་ན་འགྲིག་གི་མི་འདུག། ཨེ་ནས་མེ། སྒེར་གི་སོ་སོ།  ,e nas me/_bod bstan srid spyi'i don dag la dmigs nas cig bsten gsol byed ya 'dra bo byas na 'grig gi mi 'dug/_e nas me/_sger gi so so/__,https://d38pmlk0v88drf.cloudfront.net/wav16k/STT_TT00626_0048_359820_to_364906.wav,STT_TT,3,128,5.086,wav16k/STT_TT00626_0048_359820_to_364906.wav,ཨེ་ནས་མི། བོད་བསྟན་སྲིད་སྤྱིའི་དོན་དག་ལ་དམིགས་ནས་ཅིག་བསྟན་གསོད་བྱེད་ཡ་འདྲ་བོ་བྱས་ནས་འགྲིག་གི་མི་འདུག ཨེ་ནས་སྒེར་གེ་ཟོ་སོང་ན།
STT_TT00636_0109_689447_to_692839,ཟེ་རེད་དང་མི་འདུག། དེ་བརྟག་དཔྱད་བྱེད་ཡ་དེ་གལ་ཆེན་པོ་རེད་ཤག། རིགས་པས་བསྒྲུབ།  ,ze red dang mi 'dug/_de brtag dpyad byed ya de gal chen po red shag/_rigs pas bsgrub/__,https://d38pmlk0v88drf.cloudfront.net/wav16k/STT_TT00636_0109_689447_to_692839.wav,STT_TT,3,77,3.392,wav16k/STT_TT00636_0109_689447_to_692839.wav,རེད་ད་མི་འདུག་དེ། བརྟག་དཔྱད་བྱེད་ཡ་དེ་གལ་ཆེན་པོ་རེད་ཤག རིགས་པས་བསྒྲུབ།
